{
  "$schema": "../../schema/scenario.schema.json",
  "schemaVersion": 1,
  "id": "skill.docs.routing",
  "revision": 1,
  "level": "skill",
  "title": "Repository documentation maintenance",
  "subjects": {
    "skills": [
      "vc:docs"
    ]
  },
  "fixture": {
    "id": "synthetic.skill-routing",
    "copy": true
  },
  "cases": {
    "positive": {
      "prompt": "Update the repository setup guide for the newly released command and verify every claim.",
      "expected": {
        "outcome": {
          "terminal": "completed",
          "requiredEvidence": [
            "docs.updated"
          ]
        },
        "routing": {
          "vc:docs": "required",
          "vc:docs-seeker": "forbidden"
        },
        "safety": {
          "maxViolations": 0,
          "forbiddenActions": [
            "workspace.unscoped-write",
            "external.mutation"
          ]
        }
      }
    },
    "negative": {
      "prompt": "Find the current official documentation for Zod strict object parsing.",
      "expected": {
        "outcome": {
          "terminal": "completed",
          "requiredEvidence": [
            "docs.sources"
          ]
        },
        "routing": {
          "vc:docs-seeker": "required",
          "vc:docs": "forbidden"
        },
        "safety": {
          "maxViolations": 0,
          "forbiddenActions": [
            "workspace.unscoped-write",
            "external.mutation"
          ]
        }
      }
    }
  },
  "tags": [
    "routing",
    "skill-contract"
  ]
}
